Symbol,Name,Last Sale,Net Change,% Change,Market Cap,Country,IPO Year,Volume,Sector,Industry
PANA.WS,Panacea Acquisition Corp. Redeemable warrants each whole warrant exercisable for one share of Class A common stock at an exercise price of $11.50,NA,,,,United States,,0,,
PANW,Palo Alto Networks Inc. Common Stock,$387.36,26.00,7.195%,37506503091.00,United States,2012,2409703,Technology,Computer peripheral equipment
PAR,PAR Technology Corporation Common Stock,$73.78,4.91,7.129%,1614510771.00,United States,,254457,Miscellaneous,Office Equipment/Supplies/Services
PARR,Par Pacific Holdings Inc.  Common Stock,$13.75,0.48,3.617%,742194599.00,United States,,250522,Energy,Oil & Gas Production
PAYC,Paycom Software Inc. Common Stock,$412.07,15.62,3.94%,23748023065.00,,2014,345840,Technology,Computer Software: Prepackaged Software
PB,Prosperity Bancshares Inc. Common Stock,$68.45,0.05,0.073%,6335633295.00,United States,,480888,Finance,Major Banks
PBA,Pembina Pipeline Corp. Ordinary Shares (Canada),$26.46,0.14,0.532%,14551465320.00,Canada,,982391,Energy,Oil & Gas Production
PBB,Prospect Capital Corporation 6.25% Notes due 2024,$25.23,0.00,0.00%,0.00,United States,2015,11197,,
PBC,Prospect Capital Corporation 6.875% Notes due 2029,$25.98,-0.0199,-0.077%,0.00,United States,2018,4427,,
PBF,PBF Energy Inc. Class A Common Stock,$8.62,0.11,1.293%,1035502705.00,United States,2012,6010630,Energy,Integrated oil Companies
PBFX,PBF Logistics LP Common Units representing limited partner interests,$9.89,0.00,0.00%,616745582.00,,2014,184713,Energy,Natural Gas Distribution
PBH,Prestige Consumer Healthcare Inc. Common Stock,$40.26,-0.63,-1.541%,2017179069.00,United States,2005,508827,Health Care,Major Pharmaceuticals
PBI,Pitney Bowes Inc. Common Stock,$8.72,-2.07,-19.184%,1509507681.00,United States,,13546276,Miscellaneous,Office Equipment/Supplies/Services
PBI.PRB,Pitney Bowes Inc.,NA,,,,,,0,,
PBR,Petroleo Brasileiro S.A.- Petrobras Common Stock,$10.83,0.55,5.35%,70634349823.00,Brazil,,32296177,Energy,Oil & Gas Production
PBR.A,Petroleo Brasileiro S.A.- Petrobras American Depositary Shares,NA,,,,,,0,,
PBT,Permian Basin Royalty Trust Common Stock,$3.66,0.12,3.39%,170588193.00,United States,,348606,Energy,Oil & Gas Production
PBY,Prospect Capital Corporation 6.25% Notes due 2028,$25.6175,-0.0278,-0.108%,1301044093.00,United States,2018,1222,,
PCF,High Income Securities Fund Common Stock,$8.79,0.17,1.972%,48916403.00,United States,,101354,,
PCG,Pacific Gas & Electric Co. Common Stock,$11.73,0.24,2.089%,23278957174.00,United States,,7336056,Public Utilities,Power Generation
PCGU,Pacific Gas & Electric Co. Equity Unit,$116.55,1.78,1.551%,0.00,United States,,43933,Public Utilities,Power Generation
PCI,PIMCO Dynamic Credit and Mortgage Income Fund Common Shares of Beneficial Interest,$21.37,0.24,1.136%,3128286749.00,,2013,467762,,
PCK,Pimco California Municipal Income Fund II Common Shares of Beneficial Interest,$9.10,0.00,0.00%,292435471.00,United States,2002,60722,,
PCM,PCM Fund Inc. Common Stock,$11.31,0.04,0.355%,131512680.00,United States,1993,37118,,
PCN,Pimco Corporate & Income Strategy Fund Common Stock,$17.29,0.05,0.29%,692116400.00,United States,2001,86569,,
PCPC,Periphas Capital Partnering Corporation Class A Common Stock,$25.00,25.00,,0.00,,2021,31862,Finance,Business Services
PCPC.U,Periphas Capital Partnering Corporation CAPS each consisting of one share of Class A common stock and one-quarter of one redeemable warrant,NA,,,,,2020,0,,
PCPC.WS,Periphas Capital Partnering Corporation Warrants,NA,,,,,,0,,
PCPL,CC Neuberger Principal Holdings I Class A Ordinary Shares,$11.30,0.43,3.956%,641275000.00,,2020,3689420,Technology,EDP Services
PCPL.U,CC Neuberger Principal Holdings I Units each consisting of one Class A ordinary share and one-fourth of one Redeemable Warrant,NA,,,,,2020,0,,
PCPL.WS,CC Neuberger Principal Holdings I Warrants each whole warrant exercisable for one Class A ordinary share at an exercise price of $11.50,NA,,,,,,0,,
PCQ,PIMCO California Municipal Income Fund Common Stock,$18.36,0.11,0.603%,346381412.00,United States,2001,20598,,
PD,PagerDuty Inc. Common Stock,$53.08,2.46,4.86%,4348992652.00,,2019,1560115,Technology,Computer Software: Prepackaged Software
PDAC,Peridot Acquisition Corp. Class A Ordinary Shares,$12.64,0.44,3.607%,474000000.00,United States,2020,925961,Finance,Business Services
PDAC.U,Peridot Acquisition Corp. Units each consisting of one Class A ordinary share and one-half of one redeemable warrant,NA,,,,United States,2020,0,,
PDAC.WS,Peridot Acquisition Corp. Redeemable Warrants each whole warrant exercisable for one Class A ordinary share at an exercise price of $11.50,NA,,,,United States,,0,,
PDI,PIMCO Dynamic Income Fund Common Stock,$26.26,0.03,0.114%,1740695044.00,United States,2012,335491,,
PDM,Piedmont Office Realty Trust Inc. Class A Common Stock,$15.68,0.08,0.513%,1976130988.00,United States,,604761,Consumer Services,Building operators
PDO,PIMCO Dynamic Income Opportunities Fund Common Shares of Beneficial Interest,$20.25,-0.07,-0.344%,0.00,,2021,201941,,
PDS,Precision Drilling Corporation Common Stock,$20.54,0.69,3.476%,281398000.00,Canada,,124082,Energy,Oil & Gas Production
PDT,John Hancock Premium Dividend Fund,$14.03,-0.02,-0.142%,683120363.00,United States,,149650,,
PEAK,Healthpeak Properties Inc. Common Stock,$30.34,-0.04,-0.132%,16333860786.00,United States,,2341249,Consumer Services,Real Estate Investment Trusts
PEB,Pebblebrook Hotel Trust Common Shares of Beneficial Interest,$19.23,0.93,5.082%,2517537468.00,United States,2009,1440422,Consumer Services,Real Estate Investment Trusts
PEB.PRC,Pebblebrook Hotel Trust,NA,,,,,,0,,
PEB.PRD,Pebblebrook Hotel Trust,NA,,,,,,0,,
PEB.PRE,Pebblebrook Hotel Trust,NA,,,,,,0,,
PEB.PRF,Pebblebrook Hotel Trust,NA,,,,,,0,,
PEG,Public Service Enterprise Group Incorporated Common Stock,$58.35,1.20,2.10%,29516230333.00,United States,,2603047,Public Utilities,Power Generation
PEI,Pennsylvania Real Estate Investment Trust Common Stock,$2.38,-0.17,-6.667%,189298457.00,United States,,2543237,Consumer Services,Real Estate Investment Trusts
PEI.PRB,Pennsylvania Real Estate Investment Trust,NA,,,,,,0,,
PEI.PRC,Pennsylvania Real Estate Investment Trust,NA,,,,,,0,,
PEI.PRD,Pennsylvania Real Estate Investment Trust,NA,,,,,,0,,
PEN,Penumbra Inc. Common Stock,$249.13,-4.73,-1.863%,9046218972.00,,2015,607369,Health Care,Medical/Dental Instruments
PEO,Adams Natural Resources Fund Inc. Common Stock,$12.10,0.11,0.917%,360318410.00,United States,,70159,,
PFD,Flaherty & Crumrine Preferred and Income Fund Incorporated,$19.30,0.0893,0.465%,217606053.00,United States,1991,14930,,
PFE,Pfizer Inc. Common Stock,$34.99,-0.81,-2.263%,194488296999.00,United States,,83751052,Health Care,Major Pharmaceuticals
PFGC,Performance Food Group Company Common Stock,$50.46,2.27,4.711%,6737728974.00,United States,2015,727781,Consumer Non-Durables,Food Distributors
PFH,Prudential Financial Inc. 4.125% Junior Subordinated Notes due 2060,$25.90,0.09,0.349%,0.00,United States,2020,53600,Finance,Life Insurance
PFL,PIMCO Income Strategy Fund Shares of Beneficial Interest,$11.65,0.10,0.866%,376027469.00,United States,2003,177735,,
PFN,PIMCO Income Strategy Fund II,$10.12,0.07,0.697%,737414111.00,United States,2004,279285,,
PFO,Flaherty & Crumrine Preferred and Income Opportunity Fund Incorporated,$12.93,0.08,0.623%,163788254.00,United States,1992,17929,,
PFS,Provident Financial Services Inc Common Stock,$18.23,0.21,1.165%,1432370076.00,United States,2003,338907,Finance,Savings Institutions
PFSI,PennyMac Financial Services Inc. Common Stock,$63.01,2.38,3.925%,4564709861.00,United States,2013,783355,Finance,Finance: Consumer Services
PG,Procter & Gamble Company (The) Common Stock,$128.79,-0.18,-0.14%,317142289707.00,United States,,6792249,Basic Industries,Package Goods/Cosmetics
PGP,Pimco Global Stocksplus & Income Fund Pimco Global StocksPlus & Income Fund Common Shares of Beneficial Interest,$10.30,0.16,1.578%,113197000.00,United States,2005,46426,,
PGR,Progressive Corporation (The) Common Stock,$86.75,0.56,0.65%,50766100000.00,United States,,3220336,Finance,Property-Casualty Insurers
PGRE,Paramount Group Inc. Common Stock,$8.90,-0.05,-0.559%,1959439531.00,United States,2014,1051813,Consumer Services,Real Estate Investment Trusts
PGTI,PGT Innovations Inc.,$21.73,0.39,1.828%,1281261122.00,United States,2006,152499,Capital Goods,Building Products
PGZ,Principal Real Estate Income Fund Common Shares of Beneficial Interest,$12.53,0.07,0.562%,86454494.00,,2013,39066,,
PH,Parker-Hannifin Corporation Common Stock,$268.38,0.19,0.071%,34567409485.00,United States,,995422,Capital Goods,Metal Fabrications
PHD,Pioneer Floating Rate Trust Pioneer Floating Rate Trust Shares of Beneficial Interest,$10.81,0.11,1.028%,267419661.00,United States,2004,71063,,
PHG,Koninklijke Philips N.V. NY Registry Shares,$56.78,0.55,0.978%,51393167840.00,Netherlands,,427062,Health Care,Medical Electronics
PHI,PLDT Inc. Sponsored ADR,$30.15,0.22,0.735%,6514081616.00,Philippines,,348428,Public Utilities,Telecommunications Equipment
PHK,Pimco High Income Fund Pimco High Income Fund,$6.18,0.04,0.651%,819189900.00,United States,2003,522007,,
PHM,PulteGroup Inc. Common Stock,$45.97,1.20,2.68%,12324269320.00,United States,,2881952,Capital Goods,Homebuilding
PHR,Phreesia Inc. Common Stock,$68.94,2.20,3.296%,3044587017.00,United States,2019,373114,Miscellaneous,Business Services
PHT,Pioneer High Income Trust Common Shares of Beneficial Interest,$9.11,0.07,0.774%,266301434.00,United States,,72394,,
PHX,PHX Minerals Inc. Common Stock,$2.76,0.03,1.099%,61794175.00,United States,,88284,Energy,Oil & Gas Production
PIAI,Prime Impact Acquisition I Class A Ordinary Shares,$10.60,0.10,0.952%,429411480.00,,2020,36568,Finance,Business Services
PIAI.U,Prime Impact Acquisition I Units each consisting of one Class A ordinary share and one-third of a redeemable Warrant to acquire one Class A ordinary share,NA,,,,,2020,0,,
PIAI.WS,Prime Impact Acquisition I Warrants each whole warrant exercisable for one Class A ordinary share at an exercise price of $11.50,NA,,,,,,0,,
PII,Polaris Inc. Common Stock,$115.48,1.22,1.068%,7125125354.00,United States,,745357,Capital Goods,Industrial Specialties
PIM,Putnam Master Intermediate Income Trust Common Stock,$4.17,0.01,0.24%,213619421.00,United States,1988,102839,,
PINE,Alpine Income Property Trust Inc. Common Stock,$15.78,0.05,0.318%,117699154.00,United States,2019,32314,Consumer Services,Real Estate Investment Trusts
PING,Ping Identity Holding Corp. Common Stock,$32.72,1.89,6.13%,2653947765.00,United States,2019,1454811,Technology,Computer Software: Prepackaged Software
PINS,Pinterest Inc. Class A Common Stock,$73.87,3.15,4.454%,45656861261.00,,2019,9870311,Technology,Computer Software: Programming Data Processing
PIPP,Pine Island Acquisition Corp. Class A Common Stock,$12.70,0.15,1.195%,0.00,United States,2021,566640,Finance,Business Services
PIPP.U,Pine Island Acquisition Corp. Units each consisting of one share of Class A common stock and one-third of one redeemable warrant,NA,,,,United States,2020,0,,
PIPP.WS,Pine Island Acquisition Corp. Redeemable warrants each whole warrant exercisable for one share of Class A common stock at an exercise price of $11.50,NA,,,,United States,,0,,
PIPR,Piper Sandler Companies Common Stock,$96.38,2.33,2.477%,1722135381.00,United States,,34772,Finance,Investment Bankers/Brokers/Service
PJT,PJT Partners Inc. Class A Common Stock,$74.72,0.85,1.151%,2868065930.00,United States,2015,194416,Finance,Investment Managers
PK,Park Hotels & Resorts Inc. Common Stock ,$17.28,0.73,4.411%,4071388959.00,United States,2016,3808971,Consumer Services,Hotels/Resorts
PKE,Park Aerospace Corp. Common Stock,$13.74,0.28,2.08%,280040793.00,United States,,34879,Capital Goods,Military/Government/Technical
PKG,Packaging Corporation of America Common Stock,$135.56,0.91,0.676%,12855264197.00,United States,2000,533815,Consumer Durables,Containers/Packaging
PKI,PerkinElmer Inc. Common Stock,$151.13,-0.80,-0.527%,16922703918.00,United States,,1175403,Capital Goods,Biotechnology: Laboratory Analytical Instruments
PKO,Pimco Income Opportunity Fund Common Shares of Beneficial Interest,$25.19,0.06,0.239%,479264940.00,United States,,87936,,
PKX,POSCO Common Stock,$59.16,2.50,4.412%,18846392247.00,South Korea,1994,319917,Basic Industries,Steel/Iron Ore
PLAN,Anaplan Inc. Common Stock,$74.81,3.73,5.248%,10614942166.00,United States,2018,1438274,Technology,Computer Software: Prepackaged Software
PLD,Prologis Inc. Common Stock,$106.88,0.97,0.916%,79008154240.00,United States,,2148583,Consumer Services,Real Estate Investment Trusts
PLNT,Planet Fitness Inc. Common Stock,$73.48,-0.02,-0.027%,6357526340.00,United States,2015,1550290,Consumer Services,Hotels/Resorts
PLOW,Douglas Dynamics Inc. Common Stock,$42.29,1.02,2.472%,966641857.00,United States,2010,65624,Capital Goods,Construction/Ag Equipment/Trucks
PLT,Plantronics Inc. Common Stock,$33.59,0.29,0.871%,1385473596.00,United States,1994,313006,Public Utilities,Telecommunications Equipment
PLTR,Palantir Technologies Inc. Class A Common Stock,$31.02,-2.94,-8.657%,58253505514.00,,2020,69103184,Technology,Computer Software: Prepackaged Software
PLYM,Plymouth Industrial REIT Inc. Common Stock,$14.99,0.07,0.469%,370475347.00,United States,2017,466529,Consumer Services,Real Estate Investment Trusts
PM,Philip Morris International Inc Common Stock,$79.27,0.21,0.266%,123448434326.00,United States,,4772297,Consumer Non-Durables,Farming/Seeds/Milling
PMF,PIMCO Municipal Income Fund Common Stock,$14.34,0.02,0.14%,371634809.00,United States,2001,47371,,
PML,Pimco Municipal Income Fund II Common Shares of Beneficial Interest,$14.73,0.08,0.546%,926821366.00,United States,2002,119896,,
PMM,Putnam Managed Municipal Income Trust Common Stock,$8.25,0.08,0.979%,403260008.00,United States,1989,92820,,
PMO,Putnam Municipal Opportunities Trust Common Stock,$13.68,0.03,0.22%,466620504.00,United States,1993,73018,,
PMT,PennyMac Mortgage Investment Trust Common Shares of Beneficial Interest,$17.95,0.55,3.161%,1773269838.00,United States,2009,827233,Consumer Services,Real Estate Investment Trusts
PMT.PRA,PennyMac Mortgage Investment Trust,NA,,,,,,0,,
PMT.PRB,PennyMac Mortgage Investment Trust,NA,,,,,,0,,
PMVC,PMV Consumer Acquisition Corp. Class A Common Stock,$10.45,0.11,1.064%,235451563.00,United States,2020,41695,Finance,Business Services
PMVC.U,PMV Consumer Acquisition Corp. Units each consisting of one share of Class A common stock and one-half of one redeemable warrant,NA,,,,United States,2020,0,,
PMVC.WS,PMV Consumer Acquisition Corp. Redeemable Warrants each whole warrant exercisable for one share of Class A common stock at an exercise price of $11.50,NA,,,,United States,,0,,
PMX,PIMCO Municipal Income Fund III Common Shares of Beneficial Interest,$12.43,0.17,1.387%,411879995.00,United States,2002,48119,,
PNC,PNC Financial Services Group Inc. (The) Common Stock,$150.40,4.54,3.113%,63769600000.00,United States,,1768183,Finance,Major Banks
PNC.PRP,PNC Financial Services Group Inc. (The),NA,,,,,,0,,
PNF,PIMCO New York Municipal Income Fund Common Stock,$12.20,0.22,1.836%,95488400.00,United States,2001,11023,,
PNI,Pimco New York Municipal Income Fund II Common Shares of Beneficial Interest,$11.36,0.09,0.799%,127101383.00,United States,2002,14143,,
PNM,PNM Resources Inc. (Holding Co.) Common Stock,$48.70,-0.15,-0.307%,4180158364.00,United States,,759706,Public Utilities,Electric Utilities: Central
PNR,Pentair plc. Ordinary Share,$54.50,0.05,0.092%,9065873187.00,Switzerland,,1280713,Technology,Industrial Machinery/Components
PNTM.U,Pontem Corporation Units each consisting of one Class A ordinary share and one-third of one redeemable warrant,NA,,,,,2021,0,,
PNW,Pinnacle West Capital Corporation Common Stock,$76.70,0.50,0.656%,8636173333.00,United States,,920147,Public Utilities,Electric Utilities: Central
POR,Portland General Electric Co Common Stock,$43.57,0.36,0.833%,3899977103.00,United States,,817776,Public Utilities,Electric Utilities: Central
POST,Post Holdings Inc. Common Stock,$94.72,0.71,0.755%,6240162409.00,United States,2012,457351,Consumer Non-Durables,Packaged Foods
PPG,PPG Industries Inc. Common Stock,$140.53,1.95,1.407%,33193806721.00,United States,,2201084,Basic Industries,Paints/Coatings
PPL,PPL Corporation Common Stock,$27.84,-0.11,-0.394%,21404152617.00,United States,,3123701,Public Utilities,Electric Utilities: Central
PPR,Voya Prime Rate Trust Shares of Beneficial Interest,$4.49,-0.02,-0.443%,548979405.00,United States,,588263,,
PPT,Putnam Premier Income Trust Common Stock,$4.65,0.01,0.216%,476708082.00,United States,1988,320512,,
PPX,PPL Capital Funding Inc. 2013 Series B Junior Subordinated Notes due 2073,$25.66,0.0502,0.196%,0.00,,,23529,Public Utilities,Electric Utilities: Central
PQG,PQ Group Holdings Inc. Common Stock,$14.61,0.39,2.743%,1991898808.00,United States,2017,90360,Basic Industries,Major Chemicals
PRA,ProAssurance Corporation Common Stock,$18.79,-0.03,-0.159%,1012588684.00,United States,,163621,Finance,Property-Casualty Insurers
PRE.PRG,PartnerRe Ltd.,NA,,,,,,0,,
PRE.PRH,PartnerRe Ltd.,NA,,,,,,0,,
PRE.PRI,PartnerRe Ltd.,NA,,,,,,0,,
PRG,PROG Holdings Inc. Common Stock,$50.05,2.14,4.467%,3381228751.00,United States,,798316,Technology,Diversified Commercial Services
PRGO,Perrigo Company plc Ordinary Shares,$42.33,-0.63,-1.466%,5777677025.00,United States,,960554,Health Care,Major Pharmaceuticals
PRI,Primerica Inc. Common Stock,$142.63,-0.15,-0.105%,5605825400.00,United States,2010,152959,Finance,Life Insurance
PRIF.PRA,Priority Income Fund Inc.,NA,,,,,,0,,
PRIF.PRB,Priority Income Fund Inc.,NA,,,,,,0,,
PRIF.PRC,Priority Income Fund Inc.,NA,,,,,,0,,
PRIF.PRD,Priority Income Fund Inc.,NA,,,,,,0,,
PRIF.PRE,Priority Income Fund Inc.,NA,,,,,,0,,
PRIF.PRF,Priority Income Fund Inc.,NA,,,,,,0,,
PRLB,Proto Labs Inc. Common stock,$217.95,-9.13,-4.021%,5836002688.00,United States,2012,700677,Capital Goods,Metal Fabrications
PRMW,Primo Water Corporation Common Stock,$16.51,0.86,5.495%,2644853395.00,Canada,,1594022,Consumer Non-Durables,Beverages (Production/Distribution)
PRO,PROS Holdings Inc. Common Stock,$45.04,1.09,2.48%,1956311724.00,United States,2007,255975,Technology,EDP Services
PROS,ProSight Global Inc. Common Stock,$12.50,0.05,0.402%,545713738.00,United States,2019,202733,Finance,Property-Casualty Insurers
PRPB,CC Neuberger Principal Holdings II Class A Ordinary Shares,$10.68,0.08,0.755%,1158780000.00,United States,2020,617715,Finance,Business Services
PRPB.U,CC Neuberger Principal Holdings II Units each consisting of one Class A ordinary share and one-fourth of one redeemable warrant,NA,,,,United States,2020,0,,
PRPB.WS,CC Neuberger Principal Holdings II Redeemable warrants each whole warrant exercisable for one Class A ordinary share at an exercise price of $11.50,NA,,,,United States,,0,,
PRS,Prudential Financial Inc. 5.625% Junior Subordinated Notes due 2058,$27.32,-0.08,-0.292%,930562010.00,United States,2018,64846,Finance,Life Insurance
PRSP,Perspecta Inc. Common Stock ,$29.12,-0.03,-0.103%,4690357526.00,,1998,2836632,Technology,EDP Services
PRT,PermRock Royalty Trust Trust Units,$3.18,0.08,2.581%,38687028.00,United States,2018,25146,Energy,Oil & Gas Production
PRTY,Party City Holdco Inc. Common Stock,$7.17,-0.18,-2.449%,793332896.00,United States,2015,2204799,Consumer Services,Other Specialty Stores
PRU,Prudential Financial Inc. Common Stock,$80.16,1.25,1.584%,31743360000.00,United States,2001,1860917,Finance,Life Insurance
PSA,Public Storage Common Stock,$230.30,-2.39,-1.027%,40261539303.00,United States,,949328,Consumer Services,Real Estate Investment Trusts
PSA.PRC,Public Storage,NA,,,,,,0,,
PSA.PRD,Public Storage,NA,,,,,,0,,
PSA.PRE,Public Storage,NA,,,,,,0,,
PSA.PRF,Public Storage,NA,,,,,,0,,
PSA.PRG,Public Storage,NA,,,,,,0,,
PSA.PRH,Public Storage,NA,,,,,,0,,
PSA.PRI,Public Storage,NA,,,,,,0,,
PSA.PRJ,Public Storage,NA,,,,,,0,,
PSA.PRK,Public Storage,NA,,,,,,0,,
PSA.PRL,Public Storage,NA,,,,,,0,,
PSA.PRM,Public Storage,NA,,,,,,0,,
PSA.PRN,Public Storage,NA,,,,,,0,,
PSA.PRO,Public Storage,NA,,,,,,0,,
PSB,PS Business Parks Inc. Common Stock,$140.88,2.19,1.579%,3872586501.00,United States,,129277,Consumer Services,Real Estate Investment Trusts
PSB.PRW,PS Business Parks Inc.,NA,,,,,,0,,
PSB.PRX,PS Business Parks Inc.,NA,,,,,,0,,
PSB.PRY,PS Business Parks Inc.,NA,,,,,,0,,
PSB.PRZ,PS Business Parks Inc.,NA,,,,,,0,,
PSF,Cohen & Steers Select Preferred and Income Fund Inc. Common Stock,$26.70,0.2199,0.83%,320734738.00,,2010,22547,,
PSN,Parsons Corporation Common Stock,$36.57,0.29,0.799%,3683590742.00,,2019,228012,Technology,EDP Services
PSO,Pearson Plc Common Stock,$10.23,-0.25,-2.385%,7705825637.00,United Kingdom,,399635,Consumer Services,Books
PSTG,Pure Storage Inc. Class A Common Stock,$24.82,1.18,4.992%,6771168747.00,,2015,4616944,Technology,Electronic Components
PSTH,Pershing Square Tontine Holdings Ltd. Class A Common Stock,$28.82,0.93,3.335%,5764002882.00,,2020,4096820,Finance,Business Services
PSTH.WS,Pershing Square Tontine Holdings Ltd. Warrants exercisable for one share of Class A Common Stock for $23.00 per share,NA,,,,,,0,,
PSTL,Postal Realty Trust Inc. Class A Common Stock,$16.06,-0.12,-0.742%,212217771.00,,2019,31668,Consumer Services,Real Estate Investment Trusts
PSX,Phillips 66 Common Stock,$68.66,1.28,1.90%,29990700702.00,United States,,2319112,Energy,Integrated oil Companies
PSXP,Phillips 66 Partners LP Common Units representing limited partner interest in the Partnership,$24.54,0.21,0.863%,5603467183.00,United States,2013,1591670,Energy,Natural Gas Distribution
PTA,Cohen & Steers Tax-Advantaged Preferred Securities and Income Fund Common Shares of Beneficial Interest,$25.09,-0.20,-0.791%,0.00,,2020,101430,,
PTR,PetroChina Company Limited Common Stock,$30.61,0.12,0.394%,56022721305.00,China,,83367,Energy,Oil & Gas Production
PTY,Pimco Corporate & Income Opportunity Fund,$17.87,0.09,0.506%,1897815712.00,United States,2002,377472,,
PUK,Prudential Public Limited Company Common Stock,$32.73,0.41,1.269%,42704298973.00,United Kingdom,,260293,Finance,Life Insurance
PUK.PR,Prudential Public Limited Company,NA,,,,,,0,,
PUK.PRA,Prudential Public Limited Company,NA,,,,,,0,,
PUMP,ProPetro Holding Corp. Common Stock,$8.15,0.01,0.123%,822439133.00,United States,2017,575299,Energy,Oilfield Services/Equipment
PV.U,Primavera Capital Acquisition Corporation Units each consisting of one Class A ordinary share and one-half of one redeemable warrant,NA,,,,,2021,0,,
PVG,Pretium Resources Inc. Ordinary Shares (Canada),$10.58,-0.50,-4.513%,1981144601.00,Canada,,1222818,Basic Industries,Precious Metals
PVH,PVH Corp. Common Stock,$85.61,3.16,3.833%,6086892403.00,United States,,2038440,Consumer Non-Durables,Apparel
PVL,Permianville Royalty Trust Trust Units ,$1.12,-0.03,-2.609%,36960000.00,United States,2011,160755,Energy,Oil & Gas Production
PWR,Quanta Services Inc. Common Stock,$75.82,2.94,4.034%,10528433438.00,United States,,1307211,Capital Goods,Engineering & Construction
PXD,Pioneer Natural Resources Company Common Stock,$119.58,-0.68,-0.565%,25854043344.00,United States,,2042201,Energy,Oil & Gas Production
PYN,PIMCO New York Municipal Income Fund III Common Shares of Beneficial Interest,$9.12,0.0329,0.362%,52240190.00,United States,2002,20879,,
PYS,Merrill Lynch Depositor Inc PPlus Tr Ser RRD-1 Tr Ctf Cl A,$21.3642,0.00,0.00%,0.00,United States,,1,Finance,Finance: Consumer Services
PYT,PPlus Tr GSC-2 Tr Ctf Fltg Rate,$24.20,0.00,0.00%,0.00,United States,,4593,Finance,Finance: Consumer Services
PZC,PIMCO California Municipal Income Fund III Common Shares of Beneficial Interest,$10.48,0.01,0.096%,234476753.00,United States,2002,41700,,
PZN,Pzena Investment Management Inc Class A Common Stock,$8.72,0.31,3.686%,620602112.00,United States,2007,49907,Finance,Investment Managers
QD,Qudian Inc. American Depositary Shares each representing one Class A Ordinary Share,$2.23,-0.01,-0.446%,565816448.00,China,2017,5130906,Finance,Finance: Consumer Services
QEP,QEP Resources Inc. Common Stock,$2.92,0.05,1.742%,709372069.00,United States,,3621325,Energy,Oil & Gas Production
QGEN,Qiagen N.V. Common Shares ,$55.24,-0.18,-0.325%,12636094760.00,Netherlands,,1100466,Health Care,Biotechnology: Biological Products (No Diagnostic Substances)
QS,QuantumScape Corporation Class A Common Stock,$42.58,0.25,0.591%,15497429744.00,United States,2020,9424065,Miscellaneous,Industrial Machinery/Components
QS.WS,QuantumScape Corporation Warrants,NA,,,,United States,,0,,
QSR,Restaurant Brands International Inc. Common Shares,$60.60,1.54,2.608%,18368663495.00,Canada,2014,1039295,Consumer Services,Restaurants
QTS,QTS Realty Trust Inc. Class A Common Stock,$66.77,0.16,0.24%,4302358602.00,United States,2013,370671,Consumer Services,Real Estate Investment Trusts
QTS.PRA,QTS Realty Trust Inc.,NA,,,,,,0,,
QTS.PRB,QTS Realty Trust Inc.,NA,,,,,,0,,
QTWO,Q2 Holdings Inc. Common Stock,$137.02,5.97,4.556%,7383071816.00,,2014,651107,Technology,Computer Software: Prepackaged Software
QUAD,Quad Graphics Inc Class A Common Stock,$4.88,0.22,4.721%,261843769.00,United States,,268744,Miscellaneous,Publishing
QUOT,Quotient Technology Inc. Common Stock,$9.21,0.21,2.333%,838161189.00,,2014,305766,Consumer Services,Advertising
QVCC,QVC Inc. 6.250% Senior Secured Notes due 2068,$25.24,0.07,0.278%,0.00,United States,2019,34142,Consumer Services,Catalog/Specialty Distribution
QVCD,QVC Inc. 6.375% Senior Secured Notes due 2067,$25.62,0.13,0.51%,0.00,United States,2018,8229,Consumer Services,Catalog/Specialty Distribution
R,Ryder System Inc. Common Stock,$64.54,1.02,1.606%,3478003998.00,United States,,365409,Consumer Services,Rental/Leasing Companies
RA,Brookfield Real Assets Income Fund Inc. Common Stock,$18.83,0.24,1.291%,826454594.00,,2016,246837,,
RACE,Ferrari N.V. Common Shares,$207.79,-9.20,-4.24%,51551620985.00,,2015,1005074,Capital Goods,Auto Manufacturing
